{
  "$schema": "https://json-schema.org/draft/2020-12/schema",
  "$id": "https://epistola.app/schemas/catalog-manifest-v8.schema.json",
  "title": "CatalogManifest",
  "description": "Portable Epistola catalog manifest at wire version 8.",
  "type": "object",
  "properties": {
    "schemaVersion": {
      "const": 8
    },
    "catalog": {
      "$ref": "#/$defs/CatalogInfo"
    },
    "publisher": {
      "$ref": "#/$defs/PublisherInfo"
    },
    "release": {
      "$ref": "#/$defs/ReleaseInfo"
    },
    "compatibility": {
      "oneOf": [
        {
          "$ref": "#/$defs/CompatibilityInfo"
        },
        {
          "type": "null"
        }
      ]
    },
    "includes": {
      "oneOf": [
        {
          "type": "array",
          "items": {
            "$ref": "#/$defs/IncludeEntry"
          }
        },
        {
          "type": "null"
        }
      ]
    },
    "resources": {
      "type": "array",
      "items": {
        "$ref": "#/$defs/ResourceEntry"
      }
    },
    "dependencies": {
      "oneOf": [
        {
          "type": "array",
          "items": {
            "$ref": "#/$defs/DependencyRef"
          }
        },
        {
          "type": "null"
        }
      ]
    },
    "catalogDependencies": {
      "oneOf": [
        {
          "type": "array",
          "items": {
            "$ref": "#/$defs/CatalogDependency"
          }
        },
        {
          "type": "null"
        }
      ]
    }
  },
  "required": [
    "schemaVersion",
    "catalog",
    "publisher",
    "release",
    "resources"
  ],
  "additionalProperties": false,
  "$defs": {
    "CatalogInfo": {
      "type": "object",
      "properties": {
        "registry": {
          "$ref": "#/$defs/CatalogRegistry"
        },
        "namespace": {
          "$ref": "#/$defs/CatalogNamespace"
        },
        "key": {
          "description": "The catalog's key: its public address within its namespace. Until wire v8 this member was called slug.",
          "type": "string",
          "pattern": "^[a-z][a-z0-9]*(?:-[a-z0-9]+)*$",
          "minLength": 3,
          "maxLength": 50
        },
        "name": {
          "type": "string"
        },
        "description": {
          "type": [
            "string",
            "null"
          ]
        },
        "attributes": {
          "type": "array",
          "items": {
            "$ref": "#/$defs/AttributeAssignment"
          }
        },
        "keywords": {
          "oneOf": [
            {
              "type": "array",
              "items": {
                "$ref": "#/$defs/CatalogKeyword"
              },
              "maxItems": 20,
              "uniqueItems": true
            },
            {
              "type": "null"
            }
          ]
        },
        "presentation": {
          "oneOf": [
            {
              "$ref": "#/$defs/CatalogPresentation"
            },
            {
              "type": "null"
            }
          ]
        },
        "license": {
          "oneOf": [
            {
              "$ref": "#/$defs/CatalogLicense"
            },
            {
              "type": "null"
            }
          ]
        },
        "defaultTheme": {
          "description": "The theme a template that names none renders with, after the variant's own theme and the template's (ADR 0007). It names a theme in this catalog or in a catalog it depends on. Absent or null means no default theme: such a template renders with the rendering defaults alone. No render reads a tenant-wide default theme.",
          "oneOf": [
            {
              "$ref": "#/$defs/CatalogThemeRef"
            },
            {
              "type": "null"
            }
          ]
        },
        "presets": {
          "description": "The block style presets this catalog's content may use (ADR 0007), each declared once by key; a theme's blockStylePresets supplies their styles. A catalog's available presets are these plus those of the catalogs it depends on. Absent or empty means the catalog declares none. Keys are unique within the list; order carries no meaning.",
          "type": "array",
          "items": {
            "$ref": "#/$defs/CatalogPresetDeclaration"
          }
        }
      },
      "required": [
        "registry",
        "namespace",
        "key",
        "name"
      ],
      "additionalProperties": false
    },
    "CatalogRegistry": {
      "description": "The registry a catalog's namespace lives in: an exchange (exchange.epistola.app) or a domain that publishes its own catalogs (acme.com), as a lowercase DNS name in normal order. Always written in full: an archive has no default registry, which is installation configuration.",
      "type": "string",
      "maxLength": 253,
      "pattern": "^[a-z0-9]([a-z0-9-]*[a-z0-9])?(\\.[a-z0-9]([a-z0-9-]*[a-z0-9])?)+$"
    },
    "CatalogNamespace": {
      "description": "A catalog namespace within its registry, as a lowercase kebab-case slug (acme-corp). The same name in two registries is two different namespaces.",
      "type": "string",
      "minLength": 3,
      "maxLength": 63,
      "pattern": "^[a-z][a-z0-9]*(-[a-z0-9]+)*$"
    },
    "CatalogKeyword": {
      "description": "Lowercase ASCII letters and digits in hyphen-separated parts, at most 30 characters.",
      "type": "string",
      "minLength": 1,
      "maxLength": 30,
      "pattern": "^[a-z0-9]+(?:-[a-z0-9]+)*$"
    },
    "AttributeAssignment": {
      "type": "object",
      "properties": {
        "catalogKey": {
          "description": "Key of the catalog defining the attribute. Until wire v8 this member was called catalog.",
          "type": "string",
          "pattern": "^[a-z][a-z0-9]*(-[a-z0-9]+)*$"
        },
        "key": {
          "description": "Key of the attribute resource within the catalog named by catalogKey; the same rule as every resource key.",
          "type": "string",
          "pattern": "^[a-z0-9]+(-[a-z0-9]+)*$",
          "minLength": 3,
          "maxLength": 50
        },
        "value": {
          "type": "string"
        }
      },
      "required": [
        "catalogKey",
        "key",
        "value"
      ],
      "additionalProperties": false
    },
    "CatalogPresentation": {
      "type": "object",
      "properties": {
        "iconImageKey": {
          "description": "Key of the image resource in this catalog that serves as the catalog's icon. Until wire v8 this member was called iconAssetSlug.",
          "type": [
            "string",
            "null"
          ],
          "pattern": "^[a-z0-9]+(-[a-z0-9]+)*$",
          "minLength": 3,
          "maxLength": 50
        },
        "imageKeys": {
          "description": "Keys of the image resources in this catalog shown in its gallery, in order. Until wire v8 this member was called imageAssetSlugs.",
          "type": "array",
          "items": {
            "type": "string",
            "pattern": "^[a-z0-9]+(-[a-z0-9]+)*$",
            "minLength": 3,
            "maxLength": 50
          },
          "uniqueItems": true
        }
      },
      "additionalProperties": false
    },
    "CatalogLicense": {
      "type": "object",
      "properties": {
        "name": {
          "type": "string",
          "minLength": 1,
          "pattern": "^\\S(?:.*\\S)?$"
        },
        "spdxExpression": {
          "type": [
            "string",
            "null"
          ],
          "pattern": "^\\S(?:.*\\S)?$"
        },
        "url": {
          "type": [
            "string",
            "null"
          ],
          "pattern": "^https?://\\S+$"
        },
        "copyrightText": {
          "type": [
            "string",
            "null"
          ],
          "pattern": "^\\S(?:.*\\S)?$"
        }
      },
      "required": [
        "name"
      ],
      "additionalProperties": false
    },
    "CatalogThemeRef": {
      "description": "A reference to a theme resource, qualified like every other cross-catalog reference: an omitted catalogKey, namespace or registry means this catalog's own.",
      "type": "object",
      "properties": {
        "key": {
          "description": "Key of the theme resource.",
          "type": "string",
          "pattern": "^[a-z0-9]+(-[a-z0-9]+)*$",
          "minLength": 3,
          "maxLength": 50
        },
        "catalogKey": {
          "description": "Key of the catalog holding the theme. Omitted means this catalog. A theme in another catalog is in a catalog this catalog depends on.",
          "type": "string",
          "pattern": "^[a-z][a-z0-9]*(?:-[a-z0-9]+)*$",
          "minLength": 3,
          "maxLength": 50
        },
        "namespace": {
          "description": "Namespace of the catalog holding the theme. Omitted means this catalog's namespace.",
          "$ref": "#/$defs/CatalogNamespace"
        },
        "registry": {
          "description": "Registry of the catalog holding the theme. Omitted means this catalog's registry, never an installation default. Requires namespace.",
          "$ref": "#/$defs/CatalogRegistry"
        }
      },
      "required": [
        "key"
      ],
      "dependentRequired": {
        "registry": [
          "namespace"
        ]
      },
      "additionalProperties": false
    },
    "CatalogPresetDeclaration": {
      "description": "A block style preset the catalog declares: the name a block's stylePreset uses, shown to authors with its display name and description.",
      "type": "object",
      "properties": {
        "key": {
          "description": "The preset's key: the value a block's stylePreset names, and the key a theme's blockStylePresets styles it under.",
          "type": "string",
          "pattern": "^[a-z][a-z0-9]*(?:-[a-z0-9]+)*$",
          "minLength": 1,
          "maxLength": 50
        },
        "name": {
          "description": "Display name.",
          "type": "string",
          "minLength": 1,
          "maxLength": 100
        },
        "description": {
          "type": [
            "string",
            "null"
          ],
          "maxLength": 500
        }
      },
      "required": [
        "key",
        "name"
      ],
      "additionalProperties": false
    },
    "PublisherInfo": {
      "type": "object",
      "properties": {
        "name": {
          "type": "string"
        },
        "url": {
          "type": [
            "string",
            "null"
          ]
        }
      },
      "required": [
        "name"
      ],
      "additionalProperties": false
    },
    "ReleaseInfo": {
      "type": "object",
      "properties": {
        "version": {
          "description": "The release's number: MAJOR.MINOR.PATCH without leading zeros, and without a pre-release or build part, at most 50 characters; the same rule as the API's ReleaseVersion.",
          "type": "string",
          "pattern": "^(0|[1-9][0-9]*)\\.(0|[1-9][0-9]*)\\.(0|[1-9][0-9]*)$",
          "maxLength": 50
        },
        "releasedAt": {
          "type": [
            "string",
            "null"
          ]
        },
        "fingerprint": {
          "description": "The canonical fingerprint of the release's content, in the form that names its algorithm: v5:<lowercase SHA-256 hex>. Wire v8 requires the current algorithm, v5.",
          "type": [
            "string",
            "null"
          ],
          "pattern": "^v[1-9][0-9]*:[0-9a-f]{64}$"
        },
        "releaseId": {
          "description": "The release's id: lowercase letters, digits and single hyphens, 4 to 36 characters, the same rule as the API's CatalogReleaseId. Unique among the releases of the catalog's name (registry, namespace and key) and kept when the release moves to another installation, by the Exchange, a registry or a file, so the release is the same everywhere. Optional: an archive without one gets one when it is installed. Release metadata, like the number: the fingerprint does not cover it.",
          "type": "string",
          "pattern": "^[a-z0-9]+(-[a-z0-9]+)*$",
          "minLength": 4,
          "maxLength": 36
        },
        "metadata": {
          "description": "Producer-specific facts about the release that the contract carries but does not define, by namespace, as a variant's metadata is: each property name is a reverse-DNS namespace the producer owns (app.epistola.suite records its renderingDefaultsVersion there); only that producer writes into it, and every other reader, one that does not recognise the namespace included, keeps it as it is, member for member, when it installs, migrates or re-exports the release. Each value is a JSON object the contract does not interpret. Omitted rather than empty. Release metadata: the fingerprint does not cover it. At most 8 KiB serialized, which the validator checks.",
          "type": "object",
          "patternProperties": {
            "^[a-z][a-z0-9-]*(\\.[a-z][a-z0-9-]*)+$": {
              "type": "object"
            }
          },
          "propertyNames": {
            "maxLength": 100
          },
          "additionalProperties": false,
          "minProperties": 1,
          "maxProperties": 16
        }
      },
      "required": [
        "version"
      ],
      "additionalProperties": false
    },
    "CompatibilityInfo": {
      "type": "object",
      "properties": {
        "epistolaVersions": {
          "type": [
            "string",
            "null"
          ]
        }
      },
      "additionalProperties": false
    },
    "IncludeEntry": {
      "type": "object",
      "properties": {
        "url": {
          "type": "string"
        },
        "description": {
          "type": [
            "string",
            "null"
          ]
        }
      },
      "required": [
        "url"
      ],
      "additionalProperties": false
    },
    "ResourceEntry": {
      "type": "object",
      "properties": {
        "type": {
          "type": "string"
        },
        "key": {
          "description": "The resource's key: its public address within the catalog and its type. Until wire v8 this member was called slug.",
          "type": "string",
          "pattern": "^[a-z0-9]+(-[a-z0-9]+)*$",
          "minLength": 3,
          "maxLength": 50
        },
        "name": {
          "type": "string"
        },
        "description": {
          "description": "The resource's own description, copied from its resource detail where the resource has one (a theme, stencil, code list, or from wire v8 a template), so a listing can show it without opening the detail. Null or omitted when the resource has none. For a template that also states one in its detail the two must be equal.",
          "type": [
            "string",
            "null"
          ]
        },
        "updatedAt": {
          "type": [
            "string",
            "null"
          ]
        },
        "detailUrl": {
          "description": "Where the resource detail is: a relative path below the manifest's own directory, resolved against the archive root for a zip and against the manifest's URL for a catalog read from a URL. An optional leading ./, then segments of unreserved characters (letters, digits, - . _ ~, or a percent-encoding other than of . / or \\) separated by /. No scheme, no leading /, no backslash, no empty, . or .. segment. Written as ./resources/<type>/<key>.json.",
          "type": "string",
          "pattern": "^(?:\\./)?(?!\\.{1,2}(?:/|$))(?:[A-Za-z0-9._~-]|%(?!2[EeFf]|5[Cc])[0-9A-Fa-f]{2})+(?:/(?!\\.{1,2}(?:/|$))(?:[A-Za-z0-9._~-]|%(?!2[EeFf]|5[Cc])[0-9A-Fa-f]{2})+)*$"
        }
      },
      "required": [
        "type",
        "key",
        "name",
        "detailUrl"
      ],
      "additionalProperties": false
    },
    "DependencyRef": {
      "description": "Every dependency names a catalog (registry, namespace and key) from wire v8, so this is exactly CatalogDependencyRef. A dependency carries no version; the catalog it names must be declared in catalogDependencies.",
      "oneOf": [
        {
          "$ref": "#/$defs/CatalogDependencyRef"
        }
      ]
    },
    "CatalogDependencyRef": {
      "type": "object",
      "properties": {
        "type": {
          "enum": [
            "theme",
            "stencil",
            "codeList",
            "font",
            "image"
          ]
        },
        "registry": {
          "$ref": "#/$defs/CatalogRegistry"
        },
        "namespace": {
          "$ref": "#/$defs/CatalogNamespace"
        },
        "catalogKey": {
          "type": "string",
          "pattern": "^[a-z][a-z0-9]*(?:-[a-z0-9]+)*$",
          "minLength": 3,
          "maxLength": 50
        },
        "key": {
          "description": "Key of the resource within the catalog named by registry, namespace and catalogKey. Until wire v8 this member was called slug.",
          "type": "string",
          "pattern": "^[a-z0-9]+(-[a-z0-9]+)*$",
          "minLength": 3,
          "maxLength": 50
        }
      },
      "required": [
        "type",
        "registry",
        "namespace",
        "catalogKey",
        "key"
      ],
      "additionalProperties": false
    },
    "CatalogDependency": {
      "description": "A catalog this catalog depends on, declared once with the exact release it pins. References from this catalog's resources into it carry no version: they render with the release this declaration pins.",
      "type": "object",
      "properties": {
        "registry": {
          "$ref": "#/$defs/CatalogRegistry"
        },
        "namespace": {
          "$ref": "#/$defs/CatalogNamespace"
        },
        "catalogKey": {
          "type": "string",
          "pattern": "^[a-z][a-z0-9]*(?:-[a-z0-9]+)*$",
          "minLength": 3,
          "maxLength": 50
        },
        "releaseVersion": {
          "description": "The exact release of the dependency this catalog renders with, and that this archive's release was cut with: an exact version, not a range. A release number as release.version has it: MAJOR.MINOR.PATCH, at most 50 characters. Null only for a catalog migrated from wire v7 or earlier, which pins no release, and then releaseFingerprint is null too.",
          "type": [
            "string",
            "null"
          ],
          "pattern": "^(0|[1-9][0-9]*)\\.(0|[1-9][0-9]*)\\.(0|[1-9][0-9]*)$",
          "maxLength": 50
        },
        "releaseFingerprint": {
          "description": "The fingerprint of the release releaseVersion names, copied from that release's own release.fingerprint, in the form that names its algorithm (v5:<lowercase SHA-256 hex>), so a copy of that release fetched from any registry or mirror can be checked with exactly that algorithm. Null exactly when releaseVersion is null.",
          "type": [
            "string",
            "null"
          ],
          "pattern": "^v[1-9][0-9]*:[0-9a-f]{64}$"
        }
      },
      "required": [
        "registry",
        "namespace",
        "catalogKey",
        "releaseVersion",
        "releaseFingerprint"
      ],
      "if": {
        "properties": {
          "releaseVersion": {
            "type": "null"
          }
        }
      },
      "then": {
        "properties": {
          "releaseFingerprint": {
            "type": "null"
          }
        }
      },
      "else": {
        "properties": {
          "releaseFingerprint": {
            "type": "string"
          }
        }
      },
      "additionalProperties": false
    }
  }
}
