{
  "schemaVersion": 8,
  "catalog": {
    "registry": "exchange.epistola.app",
    "namespace": "acme",
    "key": "shared",
    "name": "Shared Catalog"
  },
  "publisher": {
    "name": "Acme"
  },
  "release": {
    "version": "1.1.0",
    "fingerprint": "v5:750846c6a7abca5984e548ee1b64bfb14f6160f0ba0f94d050346bbaeb0afc3a"
  },
  "resources": [
    {
      "type": "theme",
      "key": "shared",
      "name": "Shared",
      "detailUrl": "./resources/theme/shared.json"
    }
  ],
  "dependencies": [],
  "catalogDependencies": [
    {
      "alias": "base",
      "registry": "exchange.epistola.app",
      "namespace": "acme",
      "catalogKey": "base",
      "releaseVersion": "2.0.0",
      "releaseFingerprint": "v5:fea0a290719328605f1d45ec16d55e0f14746c48e0d46f41c7829719aefdf14b"
    }
  ]
}
