{
  "schemaVersion": 8,
  "catalog": {
    "registry": "exchange.epistola.app",
    "namespace": "epistola",
    "key": "fixture",
    "name": "Fixture Catalog",
    "description": "Minimal valid conformance catalog"
  },
  "publisher": {
    "name": "Epistola"
  },
  "release": {
    "version": "1.0.0",
    "fingerprint": "v6:4ef99d5bdefa57bcb76c8644383ad652d7223fdbe9f9818608a172017d475edb"
  },
  "resources": [
    {
      "type": "theme",
      "key": "default",
      "name": "Default",
      "detailUrl": "./resources/theme/default.json"
    }
  ],
  "dependencies": [],
  "catalogDependencies": []
}
