{
  "schemaVersion": 8,
  "catalog": {
    "registry": "exchange.epistola.app",
    "namespace": "acme",
    "key": "base",
    "name": "Base Catalog"
  },
  "publisher": {
    "name": "Acme"
  },
  "release": {
    "version": "2.0.0",
    "fingerprint": "v6:612746f445d1b58c09d78999f795d41b994ec77b7273fd6f558712abadf1099d"
  },
  "resources": [
    {
      "type": "theme",
      "key": "house",
      "name": "House",
      "detailUrl": "./resources/theme/house.json"
    }
  ],
  "dependencies": [],
  "catalogDependencies": []
}
