{
  "schemaVersion": 8,
  "catalog": {
    "registry": "exchange.epistola.app",
    "namespace": "epistola",
    "key": "fixture",
    "name": "Fixture Catalog"
  },
  "publisher": {
    "name": "Epistola"
  },
  "release": {
    "version": "1.0.0",
    "fingerprint": "v6:91d7583d586b0e98e6526d79711d34dc0955a03becd2cd50ef0fa5a6b0597822"
  },
  "resources": [
    {
      "type": "attribute",
      "key": "locale",
      "name": "Locale",
      "detailUrl": "./resources/attribute/locale.json"
    }
  ],
  "dependencies": [],
  "catalogDependencies": []
}
